root@lamp-s-1vcpu-1gb-tor1-01:~# tcpdump -n -i eth0

...


06:09:21.388436 IP 165.227.33.185.22 > 70.49.253.11.51632: Flags [P.], seq 1662188:1662344, ack 937, win 320, length 156
06:09:21.388512 IP 165.227.33.185.22 > 70.49.253.11.51632: Flags [P.], seq 1662344:1662500, ack 937, win 320, length 156
06:09:21.388589 IP 165.227.33.185.22 > 70.49.253.11.51632: Flags [P.], seq 1662500:1662656, ack 937, win 320, length 156
06:09:21.388663 IP 165.227.33.185.22 > 70.49.253.11.51632: Flags [P.], seq 1662656:1662812, ack 937, win 320, length 156
06:09:21.388737 IP 165.227.33.185.22 > 70.49.253.11.51632: Flags [P.], seq 1662812:1662968, ack 937, win 320, length 156
06:09:21.388793 IP 70.49.253.11.51632 > 165.227.33.185.22: Flags [.], ack 1652100, win 516, length 0
06:09:21.388874 IP 165.227.33.185.22 > 70.49.253.11.51632: Flags [P.], seq 1662968:1663228, ack 937, win 320, length 260
06:09:21.388909 IP 70.49.253.11.51632 > 165.227.33.185.22: Flags [P.], seq 937:973, ack 1652100, win 516, length 36

11104 packets captured
11130 packets received by filter